{
  "formatVersion": "0.4.0-draft",
  "metadata": {
    "id": "wizard_example_v0",
    "title": "Wizard Beispielraum V0",
    "locale": "de-DE",
    "description": "Eine Beispielkonfiguration mit den aktuell verfuegbaren V0-Bausteinen.",
    "author": {
      "name": "Beispiel Lehrkraft",
      "organization": "FH Beispiel"
    }
  },
  "session": {
    "targetAudience": "Lernende im Bereich IT-Sicherheit",
    "priorKnowledge": "Grundlagen zu E-Mail, Webseiten und einfachen Codierungen.",
    "playerCount": {
      "min": 1,
      "max": 4,
      "recommended": 2
    },
    "durationMinutes": 60,
    "timeLimitMinutes": 60,
    "collaborationMode": "cooperative"
  },
  "scenario": {
    "themeId": "default",
    "playerRole": "Untersuchungsteam",
    "premise": "Ein Forschungslabor ist verriegelt. Die Gruppe muss Hinweise rekonstruieren und den Ausgang freischalten.",
    "mission": "Findet den finalen Zugangscode und oeffnet die Ausgangstuer.",
    "introText": "Der Alarm ist aktiv. Auf dem Wandtimer laufen 60 Minuten herunter.",
    "successText": "Die Ausgangstuer oeffnet sich.",
    "failureText": "Die Zeit ist abgelaufen."
  },
  "riddleGraph": {
    "startNodeId": "n_start",
    "endNodeIds": [
      "n_exit_open"
    ],
    "nodes": [
      {
        "id": "n_start",
        "kind": "start",
        "title": "Start"
      },
      {
        "id": "n_power_switch",
        "kind": "riddle",
        "title": "Strom einschalten",
        "riddleId": "r_power_switch"
      },
      {
        "id": "n_find_login_credentials",
        "kind": "riddle",
        "title": "Login-Hinweise finden",
        "riddleId": "r_find_login_credentials"
      },
      {
        "id": "n_pc_login",
        "kind": "riddle",
        "title": "Labor-PC Login",
        "riddleId": "r_pc_login"
      },
      {
        "id": "n_email_trust",
        "kind": "riddle",
        "title": "Richtige Support-Mail erkennen",
        "riddleId": "r_email_trust"
      },
      {
        "id": "n_recovery_decode",
        "kind": "riddle",
        "title": "Recovery-Code decodieren",
        "riddleId": "r_recovery_decode"
      },
      {
        "id": "n_storage_keypad",
        "kind": "riddle",
        "title": "Storage-Keypad",
        "riddleId": "r_storage_keypad"
      },
      {
        "id": "n_find_blue_usb",
        "kind": "riddle",
        "title": "Blauen USB-Stick finden",
        "riddleId": "r_find_blue_usb"
      },
      {
        "id": "n_usb_gate",
        "kind": "riddle",
        "title": "USB-Stick einsetzen",
        "riddleId": "r_usb_gate"
      },
      {
        "id": "n_connect_vent",
        "kind": "riddle",
        "title": "Lueftung verbinden",
        "riddleId": "r_connect_vent"
      },
      {
        "id": "n_final_image",
        "kind": "riddle",
        "title": "Finales Bild rekonstruieren",
        "riddleId": "r_final_image"
      },
      {
        "id": "n_exit_panel",
        "kind": "riddle",
        "title": "Ausgang oeffnen",
        "riddleId": "r_exit_panel"
      },
      {
        "id": "n_exit_open",
        "kind": "end",
        "title": "Ausgang offen"
      }
    ],
    "edges": [
      {
        "id": "e_start_to_power",
        "from": "n_start",
        "to": "n_power_switch",
        "condition": {
          "type": "always"
        }
      },
      {
        "id": "e_power_to_credentials",
        "from": "n_power_switch",
        "to": "n_find_login_credentials",
        "condition": {
          "type": "all_of_tokens",
          "tokens": [
            "token_power_on"
          ]
        }
      },
      {
        "id": "e_credentials_to_login",
        "from": "n_find_login_credentials",
        "to": "n_pc_login",
        "condition": {
          "type": "all_of_tokens",
          "tokens": [
            "token_login_credentials_found"
          ]
        }
      },
      {
        "id": "e_login_to_email",
        "from": "n_pc_login",
        "to": "n_email_trust",
        "condition": {
          "type": "all_of_tokens",
          "tokens": [
            "token_pc_logged_in"
          ]
        }
      },
      {
        "id": "e_email_to_decode",
        "from": "n_email_trust",
        "to": "n_recovery_decode",
        "condition": {
          "type": "all_of_tokens",
          "tokens": [
            "token_recovery_url_identified"
          ]
        }
      },
      {
        "id": "e_decode_to_keypad",
        "from": "n_recovery_decode",
        "to": "n_storage_keypad",
        "condition": {
          "type": "all_of_tokens",
          "tokens": [
            "token_storage_code_recovered"
          ]
        }
      },
      {
        "id": "e_keypad_to_usb",
        "from": "n_storage_keypad",
        "to": "n_find_blue_usb",
        "condition": {
          "type": "all_of_tokens",
          "tokens": [
            "token_storage_open"
          ]
        }
      },
      {
        "id": "e_usb_to_gate",
        "from": "n_find_blue_usb",
        "to": "n_usb_gate",
        "condition": {
          "type": "all_of_tokens",
          "tokens": [
            "token_blue_usb_found"
          ]
        }
      },
      {
        "id": "e_gate_to_vent",
        "from": "n_usb_gate",
        "to": "n_connect_vent",
        "condition": {
          "type": "all_of_tokens",
          "tokens": [
            "token_control_panel_available"
          ]
        }
      },
      {
        "id": "e_vent_to_final_image",
        "from": "n_connect_vent",
        "to": "n_final_image",
        "condition": {
          "type": "all_of_tokens",
          "tokens": [
            "token_ac_started"
          ]
        }
      },
      {
        "id": "e_final_image_to_exit",
        "from": "n_final_image",
        "to": "n_exit_panel",
        "condition": {
          "type": "all_of_tokens",
          "tokens": [
            "token_exit_password_revealed"
          ]
        }
      },
      {
        "id": "e_exit_to_end",
        "from": "n_exit_panel",
        "to": "n_exit_open",
        "condition": {
          "type": "all_of_tokens",
          "tokens": [
            "token_exit_open"
          ]
        }
      }
    ]
  },
  "riddles": [
    {
      "id": "r_power_switch",
      "type": "state_change",
      "title": "Strom einschalten",
      "designRole": "progression",
      "difficulty": "easy",
      "estimatedMinutes": 3,
      "playerFacingTask": "Findet den versteckten Schalter unter den Papieren.",
      "requiresTokens": [],
      "producesTokens": [
        "token_power_on"
      ],
      "assetIds": [],
      "resources": [
        {
          "id": "res_power_switch_papers",
          "kind": "world_object",
          "title": "Papierstapel mit verstecktem Schalter",
          "availability": "visible_in_level",
          "purpose": "clue"
        }
      ],
      "hints": [],
      "parameters": {
        "interactionKind": "yes_no",
        "target": "power_switch",
        "successText": "Die Stromversorgung springt an."
      }
    },
    {
      "id": "r_find_login_credentials",
      "type": "collection",
      "title": "Login-Hinweise finden",
      "designRole": "progression",
      "difficulty": "easy",
      "estimatedMinutes": 6,
      "playerFacingTask": "Durchsucht Schreibtisch und Papierkoerbe nach Login-Hinweisen.",
      "requiresTokens": [
        "token_power_on"
      ],
      "producesTokens": [
        "token_login_credentials_found"
      ],
      "assetIds": [
        "asset_note_password_1",
        "asset_note_password_2"
      ],
      "resources": [
        {
          "id": "res_password_note_1",
          "kind": "asset",
          "title": "Passwort-Notiz 1",
          "assetId": "asset_note_password_1",
          "availability": "inside_container",
          "purpose": "clue"
        },
        {
          "id": "res_password_note_2",
          "kind": "asset",
          "title": "Passwort-Notiz 2",
          "assetId": "asset_note_password_2",
          "availability": "inside_container",
          "purpose": "clue"
        }
      ],
      "hints": [
        {
          "id": "h_login_credentials_1",
          "title": "Nicht alles liegt offen",
          "text": "Ein Teil der Zugangsdaten liegt in einem Container oder Papierkorb.",
          "level": 1,
          "trigger": "manual_request"
        }
      ],
      "parameters": {
        "rewards": [
          "asset_note_password_1",
          "asset_note_password_2"
        ],
        "rewardMode": "collect_all"
      }
    },
    {
      "id": "r_pc_login",
      "type": "input",
      "title": "Labor-PC Login",
      "designRole": "progression",
      "difficulty": "easy",
      "estimatedMinutes": 5,
      "playerFacingTask": "Loggt euch am Labor-PC ein.",
      "requiresTokens": [
        "token_power_on",
        "token_login_credentials_found"
      ],
      "producesTokens": [
        "token_pc_logged_in"
      ],
      "assetIds": [],
      "resources": [
        {
          "id": "res_login_notes",
          "kind": "asset",
          "title": "Gefundene Login-Notizen",
          "assetId": "asset_note_password_1",
          "availability": "after_token",
          "requiredToken": "token_login_credentials_found",
          "purpose": "clue"
        }
      ],
      "hints": [],
      "parameters": {
        "inputMode": "credentials",
        "fields": [
          {
            "id": "username",
            "label": "E-Mail",
            "answer": "dr.mertens@ciphera-labs.com"
          },
          {
            "id": "password",
            "label": "Passwort",
            "answer": "a12b34xy"
          }
        ],
        "successAction": "unlock_computer_ui"
      }
    },
    {
      "id": "r_email_trust",
      "type": "choice",
      "title": "Richtige Support-Mail erkennen",
      "designRole": "progression",
      "difficulty": "medium",
      "estimatedMinutes": 10,